date,favorite_cnt,id,reply_to_id,retweet_cnt,text,user,user_id
Thu Sep 26 08:48:39 +0000 2019,,1177142931460939776,1176907160946655233,,"@QuentCouprie Bonjour, nous sommes navrés d’apprendre cela. Pouvez-vous nous communiquer votre adresse email en DM ?",AccorHotels France,3250849066
Tue Sep 24 08:12:01 +0000 2019,,1176408935852650496,1175443602958409728,,"@vinzniv Bonjour, nous sommes navrés d’apprendre cela. Pouvez-vous nous communiquer le nom de l’hôtel en question, les dates du séjour ainsi que votre adresse email en DM ?",AccorHotels France,3250849066
Sat Sep 21 17:08:23 +0000 2019,,1175456754295029760,1175341567479111680,,"@StephaneJaouen Bonjour Stéphane, nous sommes navrés d’apprendre cela. Pourriez-vous nous communiquer le nom exact de l’hôtel et les dates de votre séjour ainsi que votre adresse email ?",AccorHotels France,3250849066
Fri Sep 20 18:41:13 +0000 2019,,1175117725309579264,1175018812556685312,,"@Sailor_Marzon Bonsoir, nos conseillers du Service Client de l’AccorHotels Arena seront heureux de vous aider. Vous pouvez les contacter en composant le numéro: 01 49 97 51 91. Bonne journée",AccorHotels France,3250849066
Sat Oct 12 11:57:05 +0000 2019,,1182988557700472833,1182561699850870784,,"@Revan_R6 Bonjour, nous avons répondu à votre message sur notre page TWITTER «Mercure FR». Nous vous invitons à consulter votre DM. Bonne journée",AccorHotels France,3250849066
Fri Oct 11 13:29:08 +0000 2019,,1182649334959083521,1181993605898133506,,"@ygini @BoseFR Bonjour, nous sommes navrés d'apprendre cela. Pour plus d'investigations, pourriez-vous nous communiquer le nom de l’hôtel, les dates de votre séjour ainsi que votre adresse email en DM ?",Mercure Hôtels FR,2320873614
Mon Oct 07 14:49:14 +0000 2019,,1181219938889080832,1180390902491209728,,"@deefuz Bonjour Sébastien, Pourriez-vous nous communiquer le nom exact de l’hôtel et les dates de votre séjour ainsi que votre adresse email en DM?",ibis Hôtels FR,3318693700
Mon Oct 07 14:47:35 +0000 2019,,1181219523837546497,1180372129176530944,,"@vwalter_rnk Bonjour Vivien, nous vous présentons nos sincères excuses pour cela. Pourriez-vous nous communiquer le nom exact de l’hôtel et les dates de votre séjour ainsi que votre adresse email en DM?",ibis Hôtels FR,3318693700
