id,text,date,user,user_id,favorite_cnt,retweet_cnt,reply_to_id
1175305617113800706,"@mvarieras Bonjour @mvarieras, afin de vous assister, pouvez-vous nous contacter en DM ? À tout de suite.",Sat Sep 21 07:07:49 +0000 2019,Air France FR,40205617,0,0,1175169843424899078
1175269021295493120,"@LoysTwit @LoysTwit Bonjour, merci de nous avoir contactés via Twitter.
Nous vous avons apporté une réponse en DM.
Nous vous souhaitons une bonne journée.",Sat Sep 21 04:42:24 +0000 2019,Air France FR,40205617,0,0,1175264427718742018
1175164371942727680,@JacquesPlessier Merci Jacques de nous faire partager votre expérience. Nous sommes ravis que nos équipes aient su vous surprendre et vous rapporter votre objet tant aimé. Nous vous souhaitons une agréable journée.,Fri Sep 20 21:46:34 +0000 2019,Air France FR,40205617,0,0,1175149251690717184
1175124623953936387,"@aurelien_le_pev Bonjour Aurélien, merci de nous contacter via Twitter.
Afin de vous assister, pouvez-vous nous communiquer en DM votre référence de réservation? À tout de suite.",Fri Sep 20 19:08:37 +0000 2019,Air France FR,40205617,0,0,1175108513703636994
1175122095484919809,"@Clem_baz Bonjour Clem, merci de nous contacter via Twitter.
Afin de vous assister, pouvez-vous nous contacter en DM avec la ou les références concernées par votre demande ? À tout de suite.",Fri Sep 20 18:58:34 +0000 2019,Air France FR,40205617,0,0,1175120058881851393
1175096136346025984,"@narikzeivFN Bonjour @narikzeivFN, afin de vous renseigner, merci de nous communiquer votre référence de réservation ou votre numéro de billet commençant par 057 en DM. À tout de suite.",Fri Sep 20 17:15:25 +0000 2019,Air France FR,40205617,0,0,1175091444828254213
1175052371694632960,"@djsnake81 @djsnake81 nous vous informons qu’une réponse vous a été apportée en DM.

Nous vous souhaitons une bonne journée.",Fri Sep 20 14:21:31 +0000 2019,Air France FR,40205617,0,0,1175042398075916290
1175049034849050625,"@mvarieras Bonjour et merci de nous contacter sur Twitter. Afin de vous renseigner au mieux, pourriez-vous nous faire part de votre référence de dossier via DM ? Nous restons disponibles.",Fri Sep 20 14:08:15 +0000 2019,Air France FR,40205617,0,0,1175048081387249664
1175041802753269762,"@djsnake81 Bonjour @djsnake81, nous souhaitons vous renseigner. Pour cela, nous vous invitons à nous communiquer votre référence de réservation en DM s'il vous plaît ? A très vite.",Fri Sep 20 13:39:31 +0000 2019,Air France FR,40205617,0,0,1175040859651399680
1175034313013891072,"@AEC73804312 Bonjour @AEC73804312, nous souhaitons vous renseigner. Pour cela, nous vous invitons à nous communiquer votre référence de réservation en DM s'il vous plaît ? A très vite.",Fri Sep 20 13:09:45 +0000 2019,Air France FR,40205617,0,0,1175033322721988608
1175018496360624129,"@hebiflux Bonjour et merci de nous avoir contactés via Twitter. Nous allons vous assister. Pouvez-vous nous en dire plus en DM ?
Nous restons disponibles.",Fri Sep 20 12:06:54 +0000 2019,Air France FR,40205617,0,0,1175016681665679362
1174993990560702469,"@FredSerriere Bonjour @FredSerriere , merci de nous avoir contactés via Twitter. Nous sommes navrés que vous rencontrez des difficultés via notre site internet. Nous allons vous assister pour effectuer votre réservation et vous invitons à nous communiquer votre demande via DM. À tout de suite.",Fri Sep 20 10:29:32 +0000 2019,Air France FR,40205617,0,0,1174990166445953025
1174969334705246209,"@AutumnWaldorf Bonjour Olivia, merci de nous avoir contactés via Twitter. Pouvez-vous nous en dire plus en DM ?
Nous restons disponibles.",Fri Sep 20 08:51:33 +0000 2019,Air France FR,40205617,0,0,1174966141271175169
1174968023389622274,"@hydra_66 Bonjour Mathieu. Nous vous remercions pour ce message fort sympathique ainsi que pour votre fidélité. Nous vous souhaitons une excellente journée. A très vite, merci.",Fri Sep 20 08:46:21 +0000 2019,Air France FR,40205617,0,0,1174961858739990528
1174964676209205249,"@faridator @faridator bnjour. Si vous voulez bien nous rejoindre en DM avec la référence de votre réservation ou votre numéro de billet, nous serons ravis de vous assister. Bonne journée et à bientôt!",Fri Sep 20 08:33:03 +0000 2019,Air France FR,40205617,0,0,1174963631785529344
1174951400117133314,@nournou86720300 Bonjour et merci de nous contacter sur Twitter. Pouvez vous nous en dire plus en DM? Nous attendons votre message.,Fri Sep 20 07:40:17 +0000 2019,Air France FR,40205617,0,0,1174949445265346563
1174929043172388865,"@pjc8719 Bonjour @pjc8719 et merci de nous avoir contacté via Twitter. Afin de vous renseigner au mieux, pouvez-vous nous communiquer votre référence de réclamation en DM ?",Fri Sep 20 06:11:27 +0000 2019,Air France FR,40205617,0,0,1174924195286831115
1174807347891507200,"@yacinovic86 Bonjour Yacine nous avons besoin de la référence de votre dossier afin de vous assister auprès du service client nous vous prions de nous la communiquer en message prive ,nous restons a votre écoute.",Thu Sep 19 22:07:53 +0000 2019,Air France FR,40205617,0,0,1174792880575193088
1174762403663425537,@yacinovic86 Pouvez-vous nous préciser par DM la référence de réclamation pour laquelle vous attendez une réponse ?,Thu Sep 19 19:09:17 +0000 2019,Air France FR,40205617,0,0,1174758677145931778
1174752410214047746,"@Noar30 Bonsoir, nous vous avons adressé une réponse par DM. Belle soirée.",Thu Sep 19 18:29:35 +0000 2019,Air France FR,40205617,0,0,1174748589072928769
1174745551621042179,@Noar30 Nous vous avons adressé une réponde en DM. Belle soirée à vous.,Thu Sep 19 18:02:19 +0000 2019,Air France FR,40205617,0,0,1174742904750911491
1174742517507592192,"@Noar30 Bonjour @Noar30, merci de nous contacter via Twitter.
Pouvez-vous nous envoyer en DM votre référence de réservation ?",Thu Sep 19 17:50:16 +0000 2019,Air France FR,40205617,0,0,1174727355149033472
1174705869281513472,"@Hania_Kassoul Hania, merci pour votre retour.
Pouvez-vous nous contacter en DM ? À tout de suite.",Thu Sep 19 15:24:38 +0000 2019,Air France FR,40205617,0,0,1174699218470146054
1174695300679852034,"@Hania_Kassoul @Hania_Kassoul, nous venons de vous l’envoyer.
L’avez-vous reçu ?
Nous restons disponibles en DM en cas de besoin.",Thu Sep 19 14:42:39 +0000 2019,Air France FR,40205617,0,0,1174693622811439104
1174692830067003393,"@Hania_Kassoul Bonjour@Hania_Kassoul, une réponse vous a été envoyée en DM.
À très vite.",Thu Sep 19 14:32:50 +0000 2019,Air France FR,40205617,0,0,1174688779153657857
1174682743973851139,"@SuperYeou Bonsoir Chloé.
Nous sommes désolés pour cette anomalie technique et allons vous aider à modifier votre billet.
Pouvez-vous nous DM votre nouvelle date de retour souhaitée svp?
Merci.",Thu Sep 19 13:52:45 +0000 2019,Air France FR,40205617,0,0,1174652855191359488
1174677073539063809,"@MaelAtr Bonjour @MaelAtr, merci de nous avoir contactés via Twitter. Nous sommes navrés pour le dysfonctionnement, nous vous invitons à essayer plus tard. Nous pouvons vous assister. Si cela vous convient, merci de nous communiquer vos informations en DM.
Nous restons disponibles.",Thu Sep 19 13:30:13 +0000 2019,Air France FR,40205617,0,0,1174672747705917440
1174661956915073024,"@dommtp @zeTravelersClub @Airbus @AFnewsroom @airfrance @skyteam @BoardingArea @AvgeeksFR @aeroport_tls Replying to @dommtp, @zeTravelersCluband 7 others
Bonjour @dommtp, le 1er vol reliera Roissy-Charles de Gaulle à Abidjan/Bamako; les autres destinations concernées sont Toronto et Séoul😊
A bientôt, Sandrine✈️",Thu Sep 19 12:30:09 +0000 2019,Air France FR,40205617,0,0,1174625703540723714
1174620187120885760,"@LFortinwine @LFortinwine, ce service est en cours. Nous vous invitons à suivre ce lien [LIEN] , où vous pourrez trouver cette information. Nous restons disponibles pour toutes autres demandes et vous souhaitons une agréable journée.",Thu Sep 19 09:44:10 +0000 2019,Air France FR,40205617,0,0,1174592027562008576
1174606629557460993,"@yacinovic86 Bonjour.  Nous entendons votre mécontentement. Avez-vous déjà effectué une réclamation auprès des compagnies à bord desquelles vous avez voyagé? Dans le cas contraire, nous vous invitons à effectuer cette opération au plus vite.
Bonne journée.",Thu Sep 19 08:50:18 +0000 2019,Air France FR,40205617,0,0,1174597976389554183
1174589764126826496,"@JacquesWitt Bonjour Jacques, n'hésitez pas à nous en dire plus en DM si vous souhaitez une assistance. Bonne journée à vous.",Thu Sep 19 07:43:17 +0000 2019,Air France FR,40205617,0,0,1174569283353006080
1174587872625799169,@treeschannels Bon vol à vous Philippe et belle échappée Madrilène ;),Thu Sep 19 07:35:46 +0000 2019,Air France FR,40205617,2,0,1174571616166174720
1174584100080029696,"@LFortinwine Bonjour @LFortinwine, merci de nous avoir contactés via Twitter. Nous ne proposons pas ce service pour le moment via notre application. Cependant, le lien suivant  vous permet de suivre votre bagage en ligne : [LIEN]
Nous vous souhaitons une bonne journée.",Thu Sep 19 07:20:46 +0000 2019,Air France FR,40205617,0,0,1174579601013714945
1174575270961000449,@her__max Bonjour Maxime. Merci de nous contacter sur Twitter. Notre application est actuellement fonctionnelle. Nous vous invitons à tenter de vous connecter via un autre appareil. N'hésitez pas à nous apporter des précisions en DM sur le dysfonctionnement rencontré. Bonne journée.,Thu Sep 19 06:45:41 +0000 2019,Air France FR,40205617,0,0,1174573336950706177
1174569885508046850,"@Al46189929 Bonjour Al, vous pourrez demander le remboursement de votre billet ou des taxes aéroportuaires ici [LIEN] juste en dessous du récapitulatif de votre voyage, rubrique Annulation/Remboursement. Cette démarche annulera l’ensemble du dossier de réservation.",Thu Sep 19 06:24:17 +0000 2019,Air France FR,40205617,0,0,1174304056757690374
1174455408683081728,@mestrade Bonjour. Nous regrettons cela. Nous constatons que vos préférences ne figurent plus dans votre profil. Pouvez-vous svp nous les communiquer en DM? Nous allons faire le nécessaire. A bientôt.,Wed Sep 18 22:49:24 +0000 2019,Air France FR,40205617,0,0,1174398082794082304
1174398478073638916,"@T_Anyjay Bonjour @Anyjay, merci de nous contacter sur Twitter.
Nous allons vous assister. Pouvez-vous nous en dire plus en DM ? Merci à vous.",Wed Sep 18 19:03:11 +0000 2019,Air France FR,40205617,0,0,1174378571231612928
1174364366076071936,"@tiboxstick Merci, nous vous répondons de suite.",Wed Sep 18 16:47:38 +0000 2019,Air France FR,40205617,0,0,1174362850288123911
1174362483198480389,"@tiboxstick Bonjour, afin de vous assister, pouvez vous revenir vers nous en DM? Nous restons à votre écoute.",Wed Sep 18 16:40:09 +0000 2019,Air France FR,40205617,0,0,1174344965251653633
1174338399009947648,@0nizukaEikichi Bonjour @0nizukaEikichiet merci de nous contacter sur Twitter. Comment pouvons-nous vous aider ?  Pouvez-vous nous en dire plus en Direct Message ? Merci à vous.,Wed Sep 18 15:04:27 +0000 2019,Air France FR,40205617,0,0,1174326796671705089
1174308437439782912,"@avandevelde79 Bonjour Alexandre et merci de nous contacter sur Twitter.  Merci de nous communiquer par DM votre nom/prénom, date de naissance, numéro de carte Flying Blue, statut et adresse e-mail. A tout de suite.",Wed Sep 18 13:05:23 +0000 2019,Air France FR,40205617,0,0,1174307211717337088
1174300608951672832,"@Sylvain___B Bonjour Sylvain, nous regrettons ce dysfonctionnement. Pouvez-vous en DM nous indiquer le parcours, numéros de vols, dates de voyage ?
Nous restons disponibles.",Wed Sep 18 12:34:17 +0000 2019,Air France FR,40205617,0,0,1174297614327701505
1174295673614798848,"@LaurentEdel Bonjour @LaurentEdel, toute demande d'annulation doit être effectuée par le client lui-même via le site Air France. Nous n'avons pas, via ce canal, la possibilité d'annuler une réservation. Nous restons disponibles.",Wed Sep 18 12:14:40 +0000 2019,Air France FR,40205617,0,0,1174292496207233024
1174285624012091392,"@Ze_Pueqeno Bonjour @Ze_Pueqeno, nous regrettons que vous n'appréciez pas forcément leur compagnie; mais à bord de nos vols, nos petits voyageurs en culotte courte sont toujours les bienvenus 😉 
Bonne journée, Sandrine ✈",Wed Sep 18 11:34:44 +0000 2019,Air France FR,40205617,0,1,1174176657160232961
1174278785455263745,"@marcfredericgo Bonjour @marcfredericgo, merci de nous avoir contactés sur Twitter. Nous venons de vous contacter par DM concernant votre demande. 
À très vite.",Wed Sep 18 11:07:34 +0000 2019,Air France FR,40205617,0,0,1174273097517731842
1174256504926609408,"@Lenoir88Lenoir Bonjour Charlotte, nous prenons connaissance de votre message et regrettons votre ressenti. Nous vous invitons à faire part de votre expérience à notre service client ici [LIEN]  
Nous vous remercions de prendre le temps de nous écrire.",Wed Sep 18 09:39:02 +0000 2019,Air France FR,40205617,0,0,1174254923976007682
1174216794392997889,"@cynthiamoussi Bonjour, nous allons vous assister. Pouvez-vous nous en dire plus en DM ? Merci à vous",Wed Sep 18 07:01:14 +0000 2019,Air France FR,40205617,0,0,1174146973756264448
1174172671342534656,"@xenirox @xenirox, une réponse vous a été apportée en DM. Nous vous souhaitons une bonne journée.",Wed Sep 18 04:05:54 +0000 2019,Air France FR,40205617,0,0,1173958373357883394
1174163453612875776,"@ohcourant @ohcourant Bonjour, nous vous remercions de nous avoir contactés sur Twitter. Nous vous invitons à consulter notre site ici : [LIEN] pour plus d’informations.
Nous restons disponibles si besoin.",Wed Sep 18 03:29:16 +0000 2019,Air France FR,40205617,0,0,1174094706285977606
1174091726077726721,@miiskine Bonsoir @miiskine et merci de nous avoir contactés via Twitter. Nous allons vous assister. Pouvez-vous nous en dire plus en DM ? Merci à vous,Tue Sep 17 22:44:15 +0000 2019,Air France FR,40205617,0,0,1174054730894589954
1174090101141450752,"@18Rowling @Bonjour, merci de nous avoir contactés sur Twitter. Afin de vous renseigner, merci de nous communiquer votre référence de réservation en DM.",Tue Sep 17 22:37:48 +0000 2019,Air France FR,40205617,0,0,1174072201731067906
1174071317114621954,"@rayurebleue Bonsoir @rayurebleue et bienvenue sur notre Twitter. Nous allons vous assister. Merci de nous communiquer par DM votre nom/prénom, date de naissance, numéro de carte Flying Blue, statut et adresse e-mail. A tout de suite.",Tue Sep 17 21:23:09 +0000 2019,Air France FR,40205617,0,0,1174037862129569792
1174061083738476549,"@axelvitch Bonjour, bienvenue sur Twitter. Nous vous invitons à nous en dire plus DM. 
Nous restons à votre écoute.",Tue Sep 17 20:42:30 +0000 2019,Air France FR,40205617,0,0,1174024102652366848
1174047367668146176,"@Marion_MyAnh @Marion_Myanh, afin de vous aidez au mieux, pouvez-vous nous communiquez votre référence de réservation par message privé. Nous restons disponibles.",Tue Sep 17 19:47:59 +0000 2019,Air France FR,40205617,0,0,1174042793716658178
1177480695611981828,"@samlecorsaire Bonjour @samlecorsaire, merci de nous contacter via Twitter.
Afin de vous assister, pouvez-vous nous contacter en DM ? À tout de suite.",Fri Sep 27 07:10:49 +0000 2019,Air France FR,40205617,0,0,1176868613044736000
1177458938779820032,"@calexandre974 @calexandre974 bonjour! Si vous voulez bien nous rejoindre en DM afin de nous exposer votre suggestion plus en détail, nous serons ravis de vous assister. Bonne journée et à bientôt!",Fri Sep 27 05:44:21 +0000 2019,Air France FR,40205617,0,0,1177392149505150978
1177406910456356867,"@NY44c Bonjour @NY44c, merci de nous contacter sur Twitter.
Nous allons vous assister. Pouvez-vous nous en dire plus en DM ? 
Merci à vous.",Fri Sep 27 02:17:37 +0000 2019,Air France FR,40205617,0,0,1177344926587281408
1177352460748382208,"@Didouush Bonsoir @Didouush, merci de nous contacter sur Twitter.
Afin de vous aider à réserver votre billet, merci de nous préciser par DM votre parcours, dates de voyage, vols choisis, ainsi que le nombre de voyageurs.
Nous restons disponibles.",Thu Sep 26 22:41:15 +0000 2019,Air France FR,40205617,0,0,1177313130885603328
1177532687344701442,"@Maubry_exe Bonjour, nous allons vous assister. Pouvez-vous nous en dire plus en DM ? Merci à vous",Fri Sep 27 10:37:24 +0000 2019,Air France FR,40205617,0,0,1177528510421852161
1177515398234697729,"@cyberguerre Bonjour Nicolas, bienvenue sur Twitter.
Il arrive que certaines des compagnies partenaires n'autorisent pas l'enregistrement via notre site. Dans ce cas, nous vous invitons à essayer via le site Internet de la compagnie en question ou directement à l'aéroport.
Belle journée.",Fri Sep 27 09:28:42 +0000 2019,Air France FR,40205617,1,1,1177511962973888518
1177586280571506693,"@vanessaweb Bonjour Vanessa, nous allons vous assister. Pouvez-vous nous en dire plus en DM ? Etes-vous sur le site TRANSAVIA ou sur le site Air France avec des vols opérés par TRANSAVIA ? Merci à vous",Fri Sep 27 14:10:22 +0000 2019,Air France FR,40205617,0,0,1177582803824848896
1177583427115212800,"@noorghdr @AnneRigail @AirFranceKLM Bonjour, Air France a renoué avec la tradition de baptiser ses avions. Les prochains A350 porteront également le nom de villes françaises. Bonne journée ! Clémence",Fri Sep 27 13:59:02 +0000 2019,Air France FR,40205617,1,0,1177581590731509760
1177554006601850880,"@vramiro Bonjour @vramiro ,  merci de nous communiquer par DM votre nom/prénom, date de naissance, numéro de carte Flying Blue, statut et adresse e-mail. A tout de suite.",Fri Sep 27 12:02:07 +0000 2019,Air France FR,40205617,0,0,1177552136386895874
1177552376510713856,"@fabricegv @fabricegv Bonjour, merci de nous avoir contactés via Twitter.
Nous allons vous assister. Pouvez-vous nous en dire plus en DM ? Merci à vous",Fri Sep 27 11:55:39 +0000 2019,Air France FR,40205617,0,0,1177544592398458881
1177550816925892608,"@Nacksssss Bonjour, nous allons vous assister. Pouvez-vous nous en dire plus en DM ? Merci à vous",Fri Sep 27 11:49:27 +0000 2019,Air France FR,40205617,0,0,1177550092200554497
1177549058313003008,"@Battersea4ever @Battersea4ever Bonjour, et et merci de prendre contact avec nous via Twitter. Pourriez-vous nous recontacter en DM avec plus de précisions ainsi que votre numéro de carte Flying Blue s'il vous plaît ? A très bientôt.",Fri Sep 27 11:42:27 +0000 2019,Air France FR,40205617,0,0,1177547941797666817
1177539996108107776,"@_jonasf_ Bonjour Julien, pouvez-vous nous en dire plus en DM ? Nous restons à votre écoute.",Fri Sep 27 11:06:27 +0000 2019,Air France FR,40205617,0,0,1177537542318690307
1177760485707522050,@dear_0106 Bonjour @dear_0106 merci de nous avoir contactés via Twitter.  Nous allons vous assister. Pouvez-vous nous en dire plus en DM ? Merci à vous,Sat Sep 28 01:42:36 +0000 2019,Air France FR,40205617,0,0,1177661658145153025
1177674138007326727,"@KrasdalPopov Bonjour, afin de vous assister, merci de nous communiquer votre référence de réservation ou votre numéro de billet en DM. A très vite.",Fri Sep 27 19:59:29 +0000 2019,Air France FR,40205617,0,0,1177667323479695360
1178302637730680832,"@Ozzieloz Bonjour, nous allons vous assister. Pouvez-vous nous en dire plus en DM ? Merci à vous",Sun Sep 29 13:36:55 +0000 2019,Air France FR,40205617,0,0,1178289235436195845
1178294622474383362,"@Trefadone Bonjour, merci de nous avoir contactés sur Twitter. Vous pouvez découvrir notre offre wifi à bord Air France Connect ici [LIEN]
Nous restons disponibles.",Sun Sep 29 13:05:04 +0000 2019,Air France FR,40205617,0,0,1178233998092505088
1178280812699095040,"@Grospigeon_ Bonjour. Nous entendons votre mécontentement. Malheureusement, le service client ne peut accéder à votre demande et vous a apporté une réponse par mail le 13/09. Nous vous invitons dans ce cas à solliciter le médiateur sur le site  [LIEN].",Sun Sep 29 12:10:11 +0000 2019,Air France FR,40205617,0,0,1178274703951237120
1178261209231040512,"@champomypapy Bonjour Alassane, nous allons vous assister. Pouvez-vous nous en dire plus en DM ? À tout de suite.",Sun Sep 29 10:52:17 +0000 2019,Air France FR,40205617,0,0,1177628358504570886
1178094411315630085,"@briskly64 Bonjour Bob, merci de nous avoir contactés via Twitter.
Nous vous informons qu’une réponse vous a été apportée en DM.
Nous restons disponibles.",Sat Sep 28 23:49:30 +0000 2019,Air France FR,40205617,0,0,1178045707112140800
1178084152127709186,"@lizmarshmallows Bonsoir @lizmarshmallows, merci de nous avoir contactés via Twitter.
Nous allons vous assister. Pouvez-vous nous en dire plus en DM ?
Nous restons à votre écoute.",Sat Sep 28 23:08:44 +0000 2019,Air France FR,40205617,0,0,1177991774004006917
1177981831507038208,"@arawak18 Guillaume, nous venons de vous apporter une réponse en DM.",Sat Sep 28 16:22:09 +0000 2019,Air France FR,40205617,0,0,1177931153073999872
1177966873222111233,"@myriam_merat Bonjour @myriam_merat  Afin de vous renseigner, merci de nous communiquer votre référence de réservation en DM.",Sat Sep 28 15:22:42 +0000 2019,Air France FR,40205617,0,0,1177953849652502528
1177945782890254336,"@arawak18 Bonjour Guillaume, nous faisons le point avec les équipes.",Sat Sep 28 13:58:54 +0000 2019,Air France FR,40205617,0,0,1177931153073999872
1177935220454121472,"@myriam_merat Bonjour Myriam, nous allons vous assister. Pouvez-vous nous en dire plus en DM ? Merci à vous",Sat Sep 28 13:16:56 +0000 2019,Air France FR,40205617,0,0,1177909451300524032
1177931141401198592,"@flight_report Avec un peu d'avance, bon appétit à tous les #AvGeek",Sat Sep 28 13:00:43 +0000 2019,Air France FR,40205617,11,1,1177919693258145792
1177906710960316417,"@Origoku Bonjour @Origoku, afin de vous renseigner, merci de nous communiquer votre référence de réservation en DM. Nous restons à votre écoute.",Sat Sep 28 11:23:38 +0000 2019,Air France FR,40205617,0,0,1177845182844346368
1177871250158444544,"@Acodessa Bonjour, afin de vous assister, merci de nous communiquer votre référence de réservation en DM.
Nous restons disponibles.",Sat Sep 28 09:02:44 +0000 2019,Air France FR,40205617,0,0,1177870086624948224
1178572923659063296,"@Julesandcity Bonjour @Julesandcity, merci de nous contacter sur Twitter.
Afin de vous renseigner, merci de nous communiquer votre référence de réservation en DM.
À tout de suite.",Mon Sep 30 07:30:56 +0000 2019,Air France FR,40205617,0,0,1178506079367499777
1178571878618800129,"@Lyrca8787 Nous venons de vous apporter une réponse via DM @Lyrca8787. 
Nous restons disponibles si vous souhaitez revenir vers nous pour toute demande et vous souhaitons une agréable journée.",Mon Sep 30 07:26:47 +0000 2019,Air France FR,40205617,0,0,1178562458195238912
1178565764829319169,@Adesj69 Nous venons de vous répondre via DM. Nous restons disponibles si vous souhaitez revenir vers nous pour toute demande et vous souhaitons une agréable journée.,Mon Sep 30 07:02:29 +0000 2019,Air France FR,40205617,0,0,1178558653621628928
1178560531562676224,"@mathieum76 Bonjour Mathieu,

Nous sommes navrés pour l'annulation du vol AF 1701 due à des vérifications techniques. 
Nous restons à votre disposition ici ou en DM si besoin.",Mon Sep 30 06:41:41 +0000 2019,Air France FR,40205617,0,0,1178542517706543104
1178555547039277056,"@Adesj69 Bonjour @Adesj69 et merci de nous contacter sur Twitter.  Afin de vous renseigner au mieux, merci de nous communiquer votre référence de réservation en DM.
Nous restons à votre écoute.",Mon Sep 30 06:21:53 +0000 2019,Air France FR,40205617,0,0,1178538441480368128
1178535568730464256,"@sricardlesechos Nous vous invitons à faire une réclamation ici : [LIEN] 
 Nous espérons que votre prochain voyage aura la fluidité attendue.",Mon Sep 30 05:02:30 +0000 2019,Air France FR,40205617,0,0,1178428178790064129
1178535479186202624,"@sricardlesechos Bonjour Solange, merci de nous avoir contactés sur Twitter. 
Nous regrettons le retard de votre vol AF1043 et les conséquences que cela engendre pour votre organisation personnelle.",Mon Sep 30 05:02:09 +0000 2019,Air France FR,40205617,0,0,1178428178790064129
1178532417063260162,"@Shamoaks Bonjour @ Shamoaks, merci de nous avoir contactés via Twitter.
Nous allons vous assister. Pouvez-vous nous en dire plus en DM ? Merci à vous",Mon Sep 30 04:49:58 +0000 2019,Air France FR,40205617,0,0,1178390171206787072
1178531145052540929,"@AboutMess Bonjour @AboutMess, merci de nous avoir contactés via Twitter.
Afin d’effectuer votre réservation, nous vous invitons à nous rejoindre en DM.
Nous restons à votre écoute.",Mon Sep 30 04:44:55 +0000 2019,Air France FR,40205617,0,0,1178405915634077702
1178503384531456000,"@claralfbvr Bonjour @claralfbvr, merci de nous avoir contactés via Twitter.
Nous allons vous assister. Pouvez-vous nous en dire plus en DM ? Merci à vous",Mon Sep 30 02:54:37 +0000 2019,Air France FR,40205617,0,0,1178372919032008714
1178496209616609281,"@Impossibleme06 Bonjour @Impossibleme06, merci de nous avoir contactés via Twitter.
Pouvez-vous nous en dire plus en DM ?
Nous restons à votre écoute.",Mon Sep 30 02:26:06 +0000 2019,Air France FR,40205617,0,0,1178354587239161856
