id,text,date,user,user_id,favorite_cnt,retweet_cnt,reply_to_id
1178489803479887874,"@JUANAle89608932 Bonjour @JUANAle89608932, merci de nous avoir contactés via Twitter.
Nous mettons en vente des billets d’avion pour des dates allant jusqu’à 11 mois à l’avance. 
Nous vous souhaitons une bonne semaine.",Mon Sep 30 02:00:39 +0000 2019,Air France FR,40205617,0,0,1178354458666901506
1178448184940666888,"@leop___ Bonsoir @leop___, merci de nous avoir contactés via Twitter.
Nous regrettons le retard de votre vol.
Nous vous invitons à faire votre réclamation via ce lien [LIEN]
Nous restons disponibles si besoin et vous souhaitons une bonne soirée.",Sun Sep 29 23:15:16 +0000 2019,Air France FR,40205617,0,0,1178340942245482498
1178430095817691136,@mikashu Bonjour Michael Nous regrettons les retards que vous avez subis lors de votre voyage et le stress que cela a pu causer. Nous vous avons crée une réclamation sous reference : C-2240489 auprès de notre service client un agent reviendra vers vous le plus rapidement possible,Sun Sep 29 22:03:23 +0000 2019,Air France FR,40205617,0,0,1178403832088408065
1178413235059544064,"@BobZeHareng Bonsoir @BobZeHareng merci de nous avoir contactés via Twitter. Afin de vous renseigner, merci de nous communiquer votre référence de réservation en DM.
Nous restons disponibles.",Sun Sep 29 20:56:23 +0000 2019,Air France FR,40205617,0,0,1178321981185372160
1178651837391605763,@Bobot_life Bonjour et merci de nous contacter sur Twitter. Comment pouvons-nous vous aider ?,Mon Sep 30 12:44:30 +0000 2019,Air France FR,40205617,0,0,1178650714102521857
1178650168570322951,"@Interne_Miki Bonjour @Interne_Miki, merci de nous contacter via Twitter.
 Nous équipons progressivement nos appareils de la WIFI, à bord de certains de nos Dreamliner (Boeing 787). Vous pouvez découvrir notre offre wifi à bord Air France Connect ici [LIEN] 
Belle journée",Mon Sep 30 12:37:53 +0000 2019,Air France FR,40205617,0,0,1177744481833099264
1178648265845362689,"@AmandineBazile @AmandineBazile Bonjour Amandine, pour plus d'informations nous vous invitons à consulter la page suivante [LIEN]
Nous restons disponibles. Bon après-midi.",Mon Sep 30 12:30:19 +0000 2019,Air France FR,40205617,0,0,1178623516561874944
1178646223550648322,@kyvandoan Le nécessaire a été fait. Nous vous remercions pour votre alerte.,Mon Sep 30 12:22:12 +0000 2019,Air France FR,40205617,0,0,1178606230492897281
1178634995201724416,"@MoulinsValerie Bonjour @MoulinsValerie,merci de nous avoir contactés via Twitter.  Nous allons vous assister. Pouvez-vous nous en dire plus en DM et nous communiquer votre référence de réservation ?
Nous restons disponibles.",Mon Sep 30 11:37:35 +0000 2019,Air France FR,40205617,0,0,1178614444265545728
1178632244593926144,"@WonHoney____ @WonHoney____ Bonjour, nous allons vous assister. Pouvez-vous nous en dire plus en DM ? Merci à vous. Dans l'attente de votre retour via DM.",Mon Sep 30 11:26:39 +0000 2019,Air France FR,40205617,0,0,1178602389605101568
1178631025838247936,"@ALascault Bonjour @ALascault, nous souhaitons vous assister. Pouvez-vous nous en dire plus en DM ?
À tout de suite.",Mon Sep 30 11:21:49 +0000 2019,Air France FR,40205617,0,0,1178617543189303298
1178601830231740416,"@Macaye_Dc @Macaye_Dc Bonjour, nous allons vous assister. Pouvez-vous nous en dire plus en DM ?
 Merci à vous",Mon Sep 30 09:25:48 +0000 2019,Air France FR,40205617,0,0,1178550844771491840
1178709811065708544,"@PierreCol Pierre, toutes les remarques positives comme négatives, nous permettent de faire évoluer nos produits et services de manière significative.
Nous vous remercions d'avoir pris le temps de nous écrire et restons à votre écoute si besoin.",Mon Sep 30 16:34:52 +0000 2019,Air France FR,40205617,0,0,1178700376100544512
1178709316771237889,"@ibrahim_benlove Bonjour Ibrahim, une réponse vous a été apportée en DM.
Nous espérons que le solution de report vous conviendra.",Mon Sep 30 16:32:55 +0000 2019,Air France FR,40205617,0,0,1178707804019974144
1178694604612354049,"@Anthony_Bateman Anthony, il s'agit peut-être d'un problème de navigateur. Lors de dysfonctionnement de notre site les transactions ne sont possibles avec aucun navigateur.
Nous restons à votre disposition.",Mon Sep 30 15:34:27 +0000 2019,Air France FR,40205617,0,0,1178687958326632448
1178689457857470464,"@PierreCol Bonjour Pierre, nous vous invitons à nous communiquer votre référence de réservation ou numéro de billet.
Nous restons à votre disposition.",Mon Sep 30 15:14:00 +0000 2019,Air France FR,40205617,0,0,1178681557462204417
1178684318316744705,"@Anthony_Bateman Bonjour Anthony, actuellement nous ne recensons pas de dysfonctionnement sur la page de paiement de notre site internet sous Google Chrome. 
Nous restons à votre disposition en cas de besoin.",Mon Sep 30 14:53:35 +0000 2019,Air France FR,40205617,0,0,1178679145183797248
1178681606539796481,"@MathsLemoine Bonjour @MathsLemoine, nous vous remercions d'avoir pris le temps de nous faire partager votre expérience de voyage. Votre satisfaction est au cœur de nos priorités. Nous ne manquerons pas de transmettre votre chaleureux message à nos équipes. A très vite.",Mon Sep 30 14:42:48 +0000 2019,Air France FR,40205617,0,0,1178680089191550977
1178677801689505797,"@Fanny_Addict Bonjour Fanny, merci de nous contacter via Twitter. Nous vous avons adressé ce jour une réponse via DM.
Nous sommes navrés pour le délai de réponse. Belle journée à vous.",Mon Sep 30 14:27:41 +0000 2019,Air France FR,40205617,0,0,1178575415079776256
1178677316911849472,"@kindiaFi @kindiaFi Bonjour, nous sommes à votre disposition, pouvez-vous revenir vers nous en DM avec davantage de détails s'il vous plaît ? À tout de suite.",Mon Sep 30 14:25:45 +0000 2019,Air France FR,40205617,0,0,1178675781179990018
1178674749523841024,"@baaarbaaraaaa Bonjour @baaarbaaraaaa, merci de nous contacter via Twitter.
Pour connaitre nos meilleures offres et promotions, nous vous invitons à consulter notre site ici [LIEN] . Belle journée à vous.",Mon Sep 30 14:15:33 +0000 2019,Air France FR,40205617,0,0,1178673783328124928
1178672296401293315,"@wildly0 Bonjour, nous vous invitons à conserver en cabine vos objets de valeur, et souscrire avant d’émettre vos billets, une assurance multirisque qui offre une garantie bagage (perte, vol ou dommage). Aussi,  vous pouvez déclarer à l'enregistrement, la valeur de vos objets.",Mon Sep 30 14:05:48 +0000 2019,Air France FR,40205617,0,0,1178667592493477888
1178665902813913090,"@LinjuanZ Bonjour @LinjuanZ, merci de nous contacter via Twitter.
Afin de vous assister, pouvez-vous nous communiquer par DM votre référence de réclamation/remboursement ? À tout de suite.",Mon Sep 30 13:40:24 +0000 2019,Air France FR,40205617,0,0,1177998541689630720
1178662838887432193,"@XavierBarbot Bonjour, nous allons vous assister. Pouvez-vous nous en dire plus en DM ? Merci à vous",Mon Sep 30 13:28:13 +0000 2019,Air France FR,40205617,0,0,1178662124870098944
1178904665607610368,@sebvoyages Bonjour Seb. Nous vous remercions d’avoir pris le temps de nous faire partager votre expérience de voyage. Votre satisfaction est au cœur de nos priorités. Nous ne manquerons pas de transmettre votre chaleureux message à nos équipes. A très vite.,Tue Oct 01 05:29:09 +0000 2019,Air France FR,40205617,1,0,1178902009942032387
1178863903788486657,"@Kiwii_choco Bonjour @Kiwii_choco, merci de nous avoir contactés via Twitter.
Afin de vous établir un devis, nous vous invitons à vous rejoindre en DM.
Nous restons disponibles.",Tue Oct 01 02:47:11 +0000 2019,Air France FR,40205617,0,0,1178754708799922178
1178787723198521344,"@DominoPharrell Bonjour Domino, merci de nous avoir contactés via Twitter.
Afin d’avoir plus d’informations, nous vous invitons à contacter le service client de Vietnam Airlines.
Nous vous souhaitons une bonne journée.",Mon Sep 30 21:44:28 +0000 2019,Air France FR,40205617,0,0,1178738477011128320
1178773172499468288,"@thesweetfairy @thesweetfairy bonjour et merci beaucoup de cette charmante attention! Si vous voulez bien nous rejoindre en DM avec la référence de votre réservation ou votre numéro de billet, nous serons ravis de leur transmettre vos compliments. Bonne journée et à bientôt!",Mon Sep 30 20:46:39 +0000 2019,Air France FR,40205617,0,0,1178739579500847104
1178751001483984896,"@sanjaydhumieres Bonsoir Sanjay, nous venons de répondre à votre DM. A très vite.",Mon Sep 30 19:18:33 +0000 2019,Air France FR,40205617,0,0,1178748040141819909
1178742553883086848,"@JELENSPERGER Bonjour, nous allons vous assister. Pouvez-vous nous en dire plus en DM ? Merci à vous",Mon Sep 30 18:44:59 +0000 2019,Air France FR,40205617,0,0,1178710061847400448
1178718978837008385,"@inamsam Bonjour Malika, ,nous regrettons le retard de votre vol et les conséquences que cela engendre pour votre organisation personnelle.
Avez-vous déjà effectué une réclamation auprès de notre Service Client  via ce lien : [LIEN]",Mon Sep 30 17:11:18 +0000 2019,Air France FR,40205617,0,0,1178716695277555714
1178713087639261186,"@ibrahim_benlove A votre service Ibrahim, bonne soirée et à bientôt.",Mon Sep 30 16:47:54 +0000 2019,Air France FR,40205617,0,0,1178710801789706240
1179026808949358596,@ManonWasiolek Bonjour Manon. Nous vous remercions d’avoir pris le temps de nous faire partager votre expérience de voyage. Votre satisfaction est au cœur de nos priorités. Nous ne manquerons pas de transmettre votre chaleureux message à nos équipes. A très vite.,Tue Oct 01 13:34:31 +0000 2019,Air France FR,40205617,0,0,1179019630628786178
1179018405812359175,"@Twibby37 Bonjour @Twibby37, merci de nous avoir contactés via Twitter. Afin de vous assister au mieux, nous vous invitons à nous contacter via DM. À  tout de suite !",Tue Oct 01 13:01:07 +0000 2019,Air France FR,40205617,0,0,1179016161985478656
1179002812526710786,"@JustinePeyrot @JustinePeyrot Bonjour Justine, nous souhaitons vous assister. N'hésitez pas à nous en dire plus en DM. Nous restons disponibles.",Tue Oct 01 11:59:09 +0000 2019,Air France FR,40205617,0,0,1178980578948984839
1178999488150679555,"@SePasMoiCLui Bonjour @SePasMoiCLui, nous allons vous assister. Pouvez-vous nous en dire plus en DM ?
À tout de suite.",Tue Oct 01 11:45:57 +0000 2019,Air France FR,40205617,0,0,1178987011916603393
1178996264362545153,"@JulienR1605 Bonjour Julien, nous regrettons la livraison tardive de vos bagages. Nous venons de répondre à votre demande en DM. À tout de suite.",Tue Oct 01 11:33:08 +0000 2019,Air France FR,40205617,0,0,1178967491697156096
1178984262219026433,"@RomGGR Bonjour @RomGGR, nous regrettons les difficultés rencontrées sur notre application mobile. Pouvez-vous nous en dire plus en DM ? À tout de suite.",Tue Oct 01 10:45:27 +0000 2019,Air France FR,40205617,0,0,1178935813800910848
1178956199959642114,"@anaisfi86 Bonjour Anaïs, afin de vous renseigner, merci de nous communiquer votre référence de réservation en DM.
Nous restons disponibles.",Tue Oct 01 08:53:56 +0000 2019,Air France FR,40205617,0,0,1178911872504012800
1178954231728033797,"@kimliuzaixi Bonjour, après vérification une réponse vous a été apportée via Messenger.
Nous restons disponibles.",Tue Oct 01 08:46:07 +0000 2019,Air France FR,40205617,0,0,1178950179329904640
1179091380527931392,"@yannd75 Bonsoir, c'est une bonne question ! Nous nous renseignons et revenons vers vous.",Tue Oct 01 17:51:06 +0000 2019,Air France FR,40205617,0,0,1179077479392260097
1179086253062533121,"@JustinePeyrot Bonsoir Justine, merci de nous avoir contactés via Twitter. Pouvez-vous nous en dire plus en DM?
Nous restons disponibles.",Tue Oct 01 17:30:43 +0000 2019,Air France FR,40205617,0,0,1179060806165684224
1179213731814891520,"@l3cam3l30n Bonjour @l3cam3l30n, nous allons vous assister. Pouvez-vous nous en dire plus en DM ? Merci à vous",Wed Oct 02 01:57:17 +0000 2019,Air France FR,40205617,0,0,1179090576328794118
1179196615590121472,"@MrFiiX Bjr François, nous regrettons ces désagréments. Nous serons ravis de pouvoir vous assister en privé si besoin. Nous pouvons transmettre votre demande au service client après votre voyage si besoin. Merci de revenir vers nous.",Wed Oct 02 00:49:16 +0000 2019,Air France FR,40205617,0,0,1179147052816703488
1179174624204079104,"@Twibby37 Bonjour @Twibby37 merci d'avoir pris contact avec nous via Twitter. 
Afin d'avoir plus d'informations concernant votre demande, nous vous invitons à prendre contact auprès de notre service client via ce lien [LIEN]
Nous vous souhaitons une bonne journée.",Tue Oct 01 23:21:53 +0000 2019,Air France FR,40205617,0,0,1179023799011938304
1179106503682412544,"@riou_valentin Bonsoir @riou_valentin, nous vous remercions de nous avoir contactés via Twitter. Nous allons vous assister. Pouvez-vous nous en dire plus en DM ? 
À tout de suite.",Tue Oct 01 18:51:11 +0000 2019,Air France FR,40205617,0,0,1179079835102126083
1179286408273580032,"@AmandineBazile Bonjour@AmandineBazile , nous allons vous assister. Pouvez-vous nous en dire plus en DM ? Merci à vous",Wed Oct 02 06:46:04 +0000 2019,Air France FR,40205617,0,0,1179064290164314113
1179360501907808257,"@tagliastaserpe Bonjour. Merci de nous avoir contactés via Twitter. Afin de pouvoir vous répondre avec précisions, merci de nous communiquer en DM vos nom et prénom - date de naissance - adresse email (renseignée sur le compte Flying Blue) - numéro et statut de carte Flying Blue svp. A bientôt.",Wed Oct 02 11:40:29 +0000 2019,Air France FR,40205617,0,0,1179140492002545669
1179359541017939969,"@TravelOnMove Bonjour Tom.
Comment pouvons nous  vous   assister?",Wed Oct 02 11:36:40 +0000 2019,Air France FR,40205617,0,0,1179357132161986562
