date,favorite_cnt,id,reply_to_id,retweet_cnt,text,user,user_id
Thu Oct 03 08:04:41 +0000 2019,,1179668581182775296,1179336782321737729,,"@indaisyrable Bonjour et navré pour votre insatisfaction. Afin de faire le point sur la situation évoquée avec les équipes concernées, pouvez-vous nous indiquer en privé vos nom et agence svp ?",CIC - La Chaîne CIC,228759198
Thu Oct 03 07:59:11 +0000 2019,,1179667194915016704,1179443272705609728,,"@antoine_jne Bonjour, nous vous invitons à faire le point sur la question auprès de votre conseiller en agence, joignable notamment via la messagerie privée de votre espace personnel sur [LIEN] ou sur l'appli mobile CIC.",CIC - La Chaîne CIC,228759198
Thu Sep 26 11:30:14 +0000 2019,,1177183593006862336,1177174357627604992,,"@MeYcKa_Aziz Bonjour et navré de votre insatisfaction. Pouvez-vous nous préciser en privé vos nom, agence et motif de mécontentement afin que nous puissions remonter votre témoignage à nos équipes en charge de la relation client ?",CIC - La Chaîne CIC,228759198
Mon Oct 07 13:20:51 +0000 2019,,1181197698961154050,1180492204218953730,,"@quen_tinnn Bonjour et navré pour votre insatisfaction. En cas de difficultés ou d'incompréhension avec votre agence, notre service relation clientèle est à votre disposition pour toute réclamation en ligne, par téléphone ou par courrier, comme indiqué ici : [LIEN].",CIC - La Chaîne CIC,228759198
Mon Oct 07 13:15:11 +0000 2019,,1181196271664734208,1181140514109841408,,"@palpeter Bonjour, en cas de difficultés d'utilisation de nos services en ligne et appli, notre assistance technique est à votre disposition par les moyens indiqués sur cette page : [LIEN], ou au 0 969 39 00 22 (appel non surtaxé, 24h/24 et 7j/7).",CIC - La Chaîne CIC,228759198
Tue Oct 08 07:21:14 +0000 2019,,1181469583712149505,1181254773145837574,,"@Wreap34 Bonjour et navré pour cette situation. En cas de difficultés d'utilisation de nos services en ligne, notre assistance technique est à votre disposition par les moyens indiqués sur cette page : [LIEN], ou au 0 969 39 00 22 (appel non surtaxé, 24h/24 et 7j/7).",CIC - La Chaîne CIC,228759198
Wed Oct 09 11:15:15 +0000 2019,,1181890865062649857,1181871514393726976,,"@nikeriviere Bonjour et navré de votre insatisfaction. En cas de difficultés ou d'incompréhension avec votre agence, notre service relation clientèle est à votre disposition pour toute réclamation en ligne, par téléphone ou par courrier, comme indiqué sur notre site : [LIEN].",CIC - La Chaîne CIC,228759198
Fri Oct 11 07:23:42 +0000 2019,,1182557369206792192,1182548730098180098,,"@nikeriviere Bonjour et navré pour votre insatisfaction. Afin de faire le point sur la situation évoquée avec les équipes concernées, pouvez-vous nous indiquer en privé vos nom et agence svp ?",CIC - La Chaîne CIC,228759198
Mon Oct 14 08:34:50 +0000 2019,,1183662434751537152,1182710420538191873,,"@_kamalb Bonjour et navré pour cette situation. En cas de difficultés d'utilisation de nos services en ligne, notre assistance technique est à votre disposition par les moyens indiqués sur cette page : [LIEN], ou au 0 969 39 00 22 (appel non surtaxé, 24h/24 et 7j/7).",CIC - La Chaîne CIC,228759198
