id,text,data,user,user_id,favorite_cnt,retweet_cnt,reply_to_id
1176163544599072768,"@Mauvais_Coton Bonjour Alizée, directement en privé avec votre identifiant de ligne. Merci !",Mon Sep 23 15:56:55 +0000 2019,Assistance Freebox,58920430,0,0,1176157248126668800
1176125560919076864,"@SoGood2558 Bonjour, vous pouvez vérifier dans les spams au cas où le mail se soit égaré ! Nous pouvons aussi vérifier les informations ensemble en DM 👌
[LIEN]",Mon Sep 23 13:25:59 +0000 2019,Assistance Freebox,58920430,0,0,1176009056022147073
1176123377960009728,"@jojoplay59 Bonjour Johan, pour toutes vos demandes je vous invite à nous joindre en privé ;-) Merci
[LIEN]",Mon Sep 23 13:17:19 +0000 2019,Assistance Freebox,58920430,0,0,1176081856166580224
1176117229726961665,"@L_Etienne5 @free @freemobile Bonjour Etienne, vous avez obtenu une réponse à votre demande par téléphone ce matin. Tout comme nous avons répondu à votre dernier message en privé et si vous souhaitez discuter du suivi de votre dossier, nous sommes toujours à votre écoute en DM 😉",Mon Sep 23 12:52:53 +0000 2019,Assistance Freebox,58920430,0,0,1176115003604328450
