,id,text,date,user,user_id,favorite_cnt,retweet_cnt,reply_to_id
0,1176785674219020290,"@kyaraaprn @ubereats_fr Oups. Force à vous les amis, on est sûrs qu'ils arrivent bientôt.",Wed Sep 25 09:09:03 +0000 2019,KFC France,79428084,1,0,1176535238551453697
1,1176785371402833921,"@YkarioTwitch Tu peux ajouter ""trolleur du dimanche"". ❤️ [LIEN]",Wed Sep 25 09:07:50 +0000 2019,KFC France,79428084,0,0,1176557947092119554
2,1176785025393659905,@frandaaiy La réponse est dans ta question. 😏,Wed Sep 25 09:06:28 +0000 2019,KFC France,79428084,0,0,1176768700285968386
3,1176782391442051072,Calmez-vous c'était juste pour savoir en fait.,Wed Sep 25 08:56:00 +0000 2019,KFC France,79428084,30,1,1176534257826590720
4,1174353266362257408,"L’offre est valable sur tous les produits, hors offre du mardi, Mégabox et gamme Petits Prix.",Wed Sep 18 16:03:31 +0000 2019,KFC France,79428084,2,0,1174352382920208385
