id,text,date,user,user_id,favorite_cnt,retweet_cnt,reply_to_id
1176756855206567936,"@BrunoBriceOurig Bonjour Bruno Brice Ourignac, nous sommes navrés de l'apprendre. Nous vous invitons à contacter notre Service Relation Clients pour leur faire part de votre expérience. Vous pouvez les joindre au 08 05 11 22 33 ou par mail à france@nissan-services.eu. Cordialement, Emilie",Wed Sep 25 07:14:32 +0000 2019,Nissan France,728364631,0,0,1176627495250083840
1176755465637773313,"@Grande_El_Turko Bonjour wolki93, la LEAF et la LEAF e+ ont une autonomie respective de 270km et 385km en cycle mixte (WLTP). Pour plus de renseignements, n'hésitez pas à télécharger cette brochure : [LIEN]. Belle journée, Emilie",Wed Sep 25 07:09:00 +0000 2019,Nissan France,728364631,1,0,1176563976957759490
1176154007204749312,@_alpha_world La GT-R 50th Anniversary existe bel et bien. Elle a en effet été présentée au salon de New York de cette année. Restez bien connecté pour en savoir plus ! Romuald,Mon Sep 23 15:19:01 +0000 2019,Nissan France,728364631,2,0,1176151498687954945
1176151485257781253,@_alpha_world N'est-ce pas ? Et ce n'est pas fini alors restez bien avec nous ! ;) Romuald,Mon Sep 23 15:09:00 +0000 2019,Nissan France,728364631,2,0,1176150333376159750
1174583905564987392,"@petitdave95 Bonjour, nous en sommes navrés. Nous en avons informé nos équipes pour que vous soyez recontacté. Cordialement, Romuald",Thu Sep 19 07:20:00 +0000 2019,Nissan France,728364631,0,0,1174525998244777984
1178206977694076930,"@gryzor74 Bonjour et désolés pour cette situation. Avez-vous réussi à joindre Nissan Assistance ? Nous pouvons informer notre service clients de votre situation mais, pour cela, il nous faudrait votre nom, vos coordonnées et le numéro de série de votre véhicule en DM. Cordialement, Romuald",Sun Sep 29 07:16:48 +0000 2019,Nissan France,728364631,0,0,1177976988381974534
1180095865421275141,"@rouanetdiane Bonjour et désolés pour votre expérience en concession. Si vous souhaitez que votre tweet soit transmis à notre service clients, pourriez-vous nous envoyer votre numéro de téléphone, votre adresse e-mail et le nom de la concession dans un message privé ? Cordialement, Romuald",Fri Oct 04 12:22:34 +0000 2019,Nissan France,728364631,0,0,1180094148663218176
1180500003783155712,@SalinxG Merci Salinx Gaël 😎 Avez-vous déjà eu le plaisir d'en conduire une ? Emilie,Sat Oct 05 15:08:28 +0000 2019,Nissan France,728364631,0,0,1180410652432711680
