date,favorite_cnt,id,reply_to_id,retweet_cnt,text,user,user_id
Sat Oct 12 12:24:46 +0000 2019,,1182995523411816448,1182986824467341312,,"@skidikipapap Bonjour, merci pour votre retour. Je transmets l'information.",RER E SNCF,945462114
Wed Oct 09 05:23:27 +0000 2019,,1181802331232493568,1181799901119823872,,"@karine825 @LIGNEP_SNCF Bonjour, il n'y a pas d'impact à signaler mise à part les modifications de composition que j'ai tweeté.",RER E SNCF,945462114
Tue Oct 08 15:27:40 +0000 2019,,1181592001608916992,1181587717517463554,,@cestpascalenom Bonjour. Pouvez-vous m'aider à identifier cette rame en m'indiquant votre gare de départ et d'arrivée ainsi que les horaires ? Ainsi que la voiture dans laquelle vous vous trouvez ? Merci pour votre aide.,RER E SNCF,945462114
Tue Oct 08 13:13:01 +0000 2019,,1181558116279881729,1181557025576275968,,"@iamnemboy Bonjour, une heure de réouverture du guichet est peut-être indiquée? Vous est-il possible dans le cas contraire de faire de la monnaie dans un commerce ? Bonne journée.",RER E SNCF,945462114
Mon Oct 07 07:22:02 +0000 2019,,1181107400075567105,1181106755197177856,,@FredericCoro Il est supprimé suite à un malaise voyageur.,RER E SNCF,945462114
Mon Oct 07 06:15:29 +0000 2019,,1181090649266905088,1181088596712988672,,"@claque2000 Bonjour ND, pourriez vous me  préciser la gare en question svp ?",RER E SNCF,945462114
