id,text,date,user,user_id,favorite_cnt,retweet_cnt,reply_to_id
1178559201850904578,"@_VINGT_CENT Bonjour, je suis ravie que votre vol au départ d'Alicante se soit déroulé dans la bonne humeur. 😃 J'espère que vous avez pu avoir une part de gâteau. 🍰 Bonne journée à vous et à bientôt sur d'autres vols ! ✈️",Mon Sep 30 06:36:24 +0000 2019,Transavia France,191872738,0,0,1.178406500177453e+18
1178614646539988993,"@MiKaL02964747 Bonjour Mika ! Je regrette le retard de votre vol et m'excuse pour la gêne occasionnée. Pouvez-vous me contacter en privé avec votre code de réservation, nom complet et adresse e-mail s'il vous plaît ? Je serai alors en mesure de vous aider. Merci beaucoup.",Mon Sep 30 10:16:43 +0000 2019,Transavia France,191872738,0,0,1.1785898137563218e+18
1178610582213287936,"@Marre_motte Bien que je sois navrée que votre vol  pour Ibiza ait été retardé, je suis ravie que vous ayez pu être guidée tout le long de votre vol dans la bonne humeur. 🙂 Bonne journée à vous et à bientôt sur un nouveau vol !",Mon Sep 30 10:00:34 +0000 2019,Transavia France,191872738,1,0,1.1785993223232307e+18
1178604499906285574,"@TimotheLefebvre Bonjour Timothé ! Pouvez-vous me communiquer en privé votre code de réservation, le nom complet des passagers et l'adresse e-mail utilisée s'il vous plaît ? Je vais regarder votre dossier pour vous en dire plus. Merci d'avance pour votre retour.",Mon Sep 30 09:36:24 +0000 2019,Transavia France,191872738,0,0,1.178598210731942e+18
1178917078335705088,"@BastMery Je reste disponible par dm si vous souhaitez me communiquer votre nom, votre numéro de réservation, le vol concerné. votre adresse e-mail et votre référence de suivi. 2/2",Tue Oct 01 06:18:29 +0000 2019,Transavia France,191872738,0,0,1.178799190601818e+18
1178916822655127553,"@BastMery Bonjour, je suis navrée si votre bagage a été égaré à deux reprises. 😕 Avez-vous pu récupérer votre valise depuis votre retour ? Nous avons sinon 21 jours pour remettre la main dessus et je vous conseille vivement de bien conserver vos factures. 1/2",Tue Oct 01 06:17:28 +0000 2019,Transavia France,191872738,0,0,1.178799190601818e+18
1179061173003665408,"@JulJRL  Bonjour ! A partir de mai 2020, depuis Paris Orly vers Lisbonne, nous avons plusieurs vols par jour. Depuis d’autres aéroports Nantes ou Lyon, il y a effectivement moins de possibilités. Vous souhaitez partir d’où ?",Tue Oct 01 15:51:04 +0000 2019,Transavia France,191872738,0,0,1.1790537453023232e+18
1179044564516122627,@cgodeaux Bonjour ! Avec grand plaisir 😁 ! Nous serons ravis de vous rencontrer pour vous présenter nos nouvelles destinations à notre stand situé 1-H118.,Tue Oct 01 14:45:04 +0000 2019,Transavia France,191872738,1,0,1.179035010638086e+18
1179291638100832256,"@Mcnassy Bonjour, j'aimerais voir votre dossier de plus près. Puis-je vous demander en privé pour la sécurité de vos données votre nom, votre numéro de réservation et votre adresse e-mail ? Je vous remercie.",Wed Oct 02 07:06:51 +0000 2019,Transavia France,191872738,0,0,1.179277016706818e+18
1179287828179623936,@__p_a_m_e_l_a_ Je vous conseille de garder un œil sur nos offres en ligne et de vous abonner à nos newsletters depuis notre page d’accueil. Je reste à votre écoute et vous souhaite une belle journée. 2/2,Wed Oct 02 06:51:43 +0000 2019,Transavia France,191872738,0,0,1.1790804817254687e+18
1179287354877628416,"@__p_a_m_e_l_a_ Bonjour, je vous remercie de penser à nous pour vos prochaines vacances. 🙂 Effectivement, nos ventes sont momentanément suspendues pour Djerba. Je ne saurais vous dire à quelle date ou à quelles conditions nous rouvrirons nos ventes. 1/2",Wed Oct 02 06:49:50 +0000 2019,Transavia France,191872738,0,0,1.1790804817254687e+18
1179357915137892354,"@CarolineFanet Bonjour Caroline, je suis profondément navrée d'apprendre que nos prix ne vous conviennent pas. 😒 Avez-vous regardé d'autres dates possibles ? Bien à vous.",Wed Oct 02 11:30:13 +0000 2019,Transavia France,191872738,0,0,1.1793484821146706e+18
1179357662812807169,"@Adri03061 Avec plaisir, les CM aussi ont été bluffés par la photo ! 😍 Belle journée. 🙂",Wed Oct 02 11:29:12 +0000 2019,Transavia France,191872738,0,0,1.1793483895589683e+18
1179344619403911168,"@jeanfranbernard Je vous conseille d’essayer avec Google Chrome. Avez-vous sinon essayé de supprimer vos cookies ? Pour ma part, j’arrive bien à renseigner les aéroports.",Wed Oct 02 10:37:23 +0000 2019,Transavia France,191872738,0,0,1.1793366583171195e+18
1179333937883168768,"@jeanfranbernard Bonjour, je regrette que vous recontriez des difficultés pour naviguer sur notre site internet. Tout semble être en ordre de notre côté. Avez-vous essayé de changer de navigateur ? Pourriez-vous m'envoyer une capture d'écran du message d'erreur  ?",Wed Oct 02 09:54:56 +0000 2019,Transavia France,191872738,0,0,1.1793228045226312e+18
1179394498427805696,"@mojitoroux Bonjour, en effet nous rencontrons quelques problèmes. 😅 Nos techniciens y travaillent hardemment ! Je vous présente mes excuses pour les désagréments. 😬",Wed Oct 02 13:55:35 +0000 2019,Transavia France,191872738,0,0,1.179357868644012e+18
1179480430006943744,@Eryo94 Bonsoir.  Pouvez-vous en DM me donner votre nom complet et adresse e-mail ? Je vais vérifier ensuite avec vous si nous avons le bon IBAN.,Wed Oct 02 19:37:02 +0000 2019,Transavia France,191872738,0,0,1.1794679111251968e+18
1179681052522094593,"@K6Fatale Bonjour. 🙂 En fait c'est une plateforme qui met les vols en connexion, donc c'est encore au passager de récupérer ses bagages puis de se ré-enregistrer pour son voyage suivant. 🙂",Thu Oct 03 08:54:14 +0000 2019,Transavia France,191872738,0,0,1.1796579763549184e+18
1179675085432598530,@Hmdfthlh Bonjour à vous. 😊 Alors je vous invite tout simplement à consulter notre page dédiée ici : [LIEN] . Il vous suffit de vous connecter sur DoHop : [LIEN] . Et ajouter vos voeux. 😌,Thu Oct 03 08:30:32 +0000 2019,Transavia France,191872738,0,0,1.1795721134365327e+18
1179674012949139456,"@shaanpura Bonjour, je suis désolée mais je ne vois pas votre message privé. L'avez-vous envoyé ? A tout de suite. 🙂",Thu Oct 03 08:26:16 +0000 2019,Transavia France,191872738,0,0,1.179527738769711e+18
1179672905262743552,"@NippleLeon1er Bonjour, je suis désolée que l'attente ne vous ait pas pleinement satisfait. 😒 C'est une suggestion en effet, vous pouvez la faire remonter ici : [LIEN] . Belle journée. ☀️",Thu Oct 03 08:21:52 +0000 2019,Transavia France,191872738,0,0,1.179501066238468e+18
1179671911565008897,"@Eryo94 Nous ne pouvons pas produire de confirmation d'annulation, je suis navrée. Opodo, doit prouver qu'ils n'ont pas reçu la somme que nous avons transférée afin que nous puissions lancer un nouveau virement sur votre compte en banque. Je reste disponible en mp au besoin.",Thu Oct 03 08:17:55 +0000 2019,Transavia France,191872738,0,0,1.1794679111251968e+18
1179648914376593409,"@shaanpura Si vous désirez toujours plus d’information sur ce retard, je vous invite à me donner votre numéro de réservation, ainsi que votre nom complet en privé. Je reste à votre disposition. Belle journée à vous.🌞2/2",Thu Oct 03 06:46:32 +0000 2019,Transavia France,191872738,0,0,1.179527738769711e+18
1179648699623989248,"@shaanpura Bonjour. Je vous prie de nous excuser pour le manque de réactivité, mais les services réseaux sont ouverts de 8 h à 22 h. 🙁 J’espère que vous avez pu trouver une solution pour votre première nuit à Naples. 1/2",Thu Oct 03 06:45:41 +0000 2019,Transavia France,191872738,0,0,1.179527738769711e+18
1179646112581509120,@Eryo94 Bonjour. Je vois qu’on a répondu favorablement à votre demande d’indemnisation ainsi que pour le remboursement de vos billets le 02 septembre dernier à l’adresse e-mail ****03@gmail.com. 🤔 Je vous invite à venir en discuter en privé. Je vous y attends.,Thu Oct 03 06:35:24 +0000 2019,Transavia France,191872738,0,0,1.1794679111251968e+18
1179641579759427585,"@Eryo94 Bonjour, je suis désolée. 😒 En effet, vous avez effectué votre réservation avec une agence de voyage virtuelle, c'est donc Opodo qui a reçu l'argent qui vous est dû. Bien à vous.",Thu Oct 03 06:17:23 +0000 2019,Transavia France,191872738,0,0,1.1794679111251968e+18
1179801579341385734,"@BoucleVoyageuse Bonjour ! Ah je vois que Joel vous a répondu et fort justement (Joel si vous êtes intéréssé, on embauche 😉) donc aucun souci pour votre gourde en cabine, il faut juste qu'elle entre dans les dimensions de votre bagage cabine. Je vous souhaite une douce journée.",Thu Oct 03 16:53:10 +0000 2019,Transavia France,191872738,0,0,1.1797969286719488e+18
1179774062916247552,"@Steph130000C Bonjour ! En effet, si vous regardez un vol à 15 jours, les prix seront plus gonflés. Le 8, 10, 28 et 30 du mois cela dit, les billets sont autour de 40e. Je reste disponible si vous avez des questions, belle journée !",Thu Oct 03 15:03:50 +0000 2019,Transavia France,191872738,0,0,1.1797672662059295e+18
1179773667288457217,@IPSA @jmlestum @francispollet @Groupe_IONIS C'était un honneur de rencontrer vos étudiants.😊 Au plaisir de travailler avec elles et eux dans le futur ! A bientôt. [LIEN],Thu Oct 03 15:02:16 +0000 2019,Transavia France,191872738,2,0,1.1797668423757046e+18
1179736502852562956,"@CarolineFanet Bonjour ! Si vous regardez à moins d'un mois du départ, les prix sont gonflés. Vous constaterez que sur la même route, les 24 et 29 du même mois, les prix sont de 39 euros. La vue globale se débloque avec le panorama du mois. Je vous souhaite une belle journée !",Thu Oct 03 12:34:35 +0000 2019,Transavia France,191872738,0,0,1.179722264612348e+18
1180010411577499648,"@paola_mason Bonjour, je suis sincèrement navrée si vous avez raté votre vol et regrette si votre avez rencontré des difficultés pour trouver notre comptoir d’enregistrement. Pourriez-vous me communiquer en privé votre nom, votre numéro de réservation, votre adresse e-mail ?",Fri Oct 04 06:43:00 +0000 2019,Transavia France,191872738,0,0,1.1800072075654513e+18
1180007006545043457,"@LeFrenchBureau Bonjour, je constate que vous nous avez également contactés sur Facebook. Je vous invite à lire ma réponse et à rester connectée sur un chanel.",Fri Oct 04 06:29:28 +0000 2019,Transavia France,191872738,0,0,1.179839585473454e+18
1180004559558762496,"@lusitanoVDF Je vous invite à me joindre en privé son nom, son numéro de réservation, son adresse e-mail. Je vous remercie. 2/2",Fri Oct 04 06:19:45 +0000 2019,Transavia France,191872738,0,0,1.1798049160528443e+18
1180004337252216834,"@lusitanoVDF Bonjour, je suis sincèrement navrée que nous ayons dû faire des ajustements sur le vol aller de votre femme. Je comprends votre déception au regard des conséquences sur son séjour. 1/2",Fri Oct 04 06:18:52 +0000 2019,Transavia France,191872738,0,0,1.1798049160528443e+18
1180003593463701510,"@AmandineD_ Bonjour, je suis sincèrement navrée que votre vol pour Amsterdam ait été annulé pour raison opérationnelle. 😕 A-t-on pu vous proposer un nouveau vol ? N'hésitez pas à me joindre en privé votre nom, votre numéro de réservation, et votre adresse e-mail.",Fri Oct 04 06:15:54 +0000 2019,Transavia France,191872738,0,0,1.1798334906003333e+18
1180074117313318912,"@mlavolle Bonjour, je suis navrée que votre vol du 28 août dernier ait été annulé et regrette que nous n'ayons pas pu vous trouver une meilleure option. 😕 Puis-je vous demander par dm votre nom, votre numéro de réservation, votre adresse e-mail et le vol en question ?",Fri Oct 04 10:56:08 +0000 2019,Transavia France,191872738,0,0,1.1800555266857083e+18
1180048457509298177,@freddelams J'espère que votre vol en lui-même se déroulera à la hauteur de vos attentes et qu'une partie du retard pourra être rattrapée en cours vol.  2/2,Fri Oct 04 09:14:11 +0000 2019,Transavia France,191872738,0,0,1.180035711837393e+18
1180048395202973698,"@freddelams Bonjour, je suis navrée de lire que votre embarquement se soit déroulée dans de telles conditions. 😕 Bien évidemment, ce n'est pas ce que nous souhaitons pour vous. 1/2",Fri Oct 04 09:13:56 +0000 2019,Transavia France,191872738,0,0,1.180035711837393e+18
1180388884145942528,@SebLaTombe Bonjour ! Je regrette le souci sur votre vol. 😕 Vous pouvez faire votre réclamation en ligne ici ([LIEN]) et le Service Client reviendra vers vous. Jpignez y les factures de vos frais imprévus. Puis-je vous aider en autre chose ?,Sat Oct 05 07:46:55 +0000 2019,Transavia France,191872738,0,0,1.1803813976279327e+18
1180370609689239552,@blaumaille Bonjour ! Je suis navré que le fauteuil de votre ami ait été abimé. Vous pouvez faire une réclamation ici ([LIEN]) et le Service Client reviendra vers vous. Je vous souhaite une belle journée.,Sat Oct 05 06:34:18 +0000 2019,Transavia France,191872738,0,0,1.1802531893519196e+18
1180367632492564480,"@ValdCajou Bonjour ! Je ne pense pas que faire ce que vous me demandez arrangera quoique ce soit. Par contre, si vous avez eu un souci sur un de nos vols, puis-je vous demander de me communiquer votre nom en privé avec votre code Transavia et une explication dudit souci ? Merci !",Sat Oct 05 06:22:28 +0000 2019,Transavia France,191872738,0,0,1.1802264689342464e+18
1180178513711828994,"@SebLaTombe Bonjour Seb, je suis sincèrement navrée que votre vol ait été annulé et j'entends bien que cela vous contrarie. Je vous propose de m'indiquer votre nom complet et numéro de réservation en mp, je vais remplir une réclamation pour vous. A bientôt.",Fri Oct 04 17:50:58 +0000 2019,Transavia France,191872738,0,0,1.1801738938747044e+18
1180139214408704001,@PhilippeBaralon Notre système d'enregistrement n'est pas défaillant. Comme vous l'avez mentionné vous-même ce sont les conditions de transport lorsque vous réservez un vol avec notre partenaire Air-France. Bien à vous.,Fri Oct 04 15:14:49 +0000 2019,Transavia France,191872738,0,0,1.1801357488944292e+18
1180136822367764480,"@OnAloalao Bonjour, je suis désolée d'apprendre que notre service clients n'est pas encore revenu vers vous. Pourriez-vous me communiquer votre nom complet et numéro de réservation en mp svp ? Belle soirée.",Fri Oct 04 15:05:18 +0000 2019,Transavia France,191872738,0,0,1.1801008040548475e+18
1180134972738412545,"@PhilippeBaralon Bonjour Filippe, je suis sincèrement navrée d'apprendre que vous avez rencontré ces difficultés lors de votre enregistrement. C'est pour cette exacte raison que nous recommandons grandement de venir 2 heures avant le décollage. Je vous souhaite un agréable vol.",Fri Oct 04 14:57:58 +0000 2019,Transavia France,191872738,0,0,1.1800545687696097e+18
1180132699580895238,"@BastienRoussea8 Bonjour! Sur nos lignes, tous les objets connectés doivent rester en ""mode avion"" durant toute la durée du vol, ce qui inclus - vous m'en voyez désolé 😕 - les liaisons par Blue tooth.",Fri Oct 04 14:48:56 +0000 2019,Transavia France,191872738,0,0,1.180102665784701e+18
1180125412111851521,@a_kadock Bonjour ! Navré si vous avez été surpris de payer pour un bagage supplémentaire. La page que vous indiquez sert à indiquer où se range l’unique bagage cabine autorisé ([LIEN] ) selon ses dimensions.,Fri Oct 04 14:19:58 +0000 2019,Transavia France,191872738,0,0,1.1800881622588457e+18
1180469872012283904,@DimitriMalignan N'hésitez surtout pas à revenir vers nous pour toute autre demande. Bon week-end à vous !,Sat Oct 05 13:08:44 +0000 2019,Transavia France,191872738,1,0,1.180464446763946e+18
1180469736506904576,"@DimitriMalignan Bonjour, bien que je regrette de lire que votre  vol pour Amsterdam ait été annulé pour raisons opérationnelles, je suis ravie de lire que nous avons pu vous trouver une solution dans votre cas. 🙂",Sat Oct 05 13:08:11 +0000 2019,Transavia France,191872738,1,0,1.180464446763946e+18
1180454184287707136,"@KmOly Puis-je vous demander par dm votre nom, votre numéro de réservation, et votre adresse e-mail ? Je vous remercie. 2/2",Sat Oct 05 12:06:23 +0000 2019,Transavia France,191872738,0,0,1.1804333332028908e+18
1180454013373943811,"@KmOly Bonjour, je suis navrée si votre vol a été annulé. 😕 Recevant de nombreuses demandes, il nous est actuellement difficile de vous apporter un retour dans les meilleurs délais. 1/2",Sat Oct 05 12:05:43 +0000 2019,Transavia France,191872738,0,0,1.1804333332028908e+18
1180525518690623489,@jul_boud @transavia Si toutefois vous n’avez rien en fin de semaine prochaine nous ferons le nécessaire. Je reste à votre disposition si vous en avez besoin. Bonne soirée. 2/2,Sat Oct 05 16:49:51 +0000 2019,Transavia France,191872738,0,0,1.1805000820614472e+18
1180901008785977344,"@BrownieDeniart Bonsoir, je suis navrée que votre vol soit reporté au lendemain en raison d'un mouvement social. 😕 Puis-je vous demander par dm votre nom, votre numéro de réservation, et votre adresse e-mail ?",Sun Oct 06 17:41:55 +0000 2019,Transavia France,191872738,1,0,1.1808977580745523e+18
1180887684044210178,"@CharlesMauriceT Bonsoir, je regrette que vous ayez eut cette mauvaise expérience. Si vous voulez m’en dire plus, je vous invite à venir en MP en me communicant votre numéro de réservation et votre nom complet. En attendant votre réponse, j’espère que votre vol s’est bien passé.",Sun Oct 06 16:48:58 +0000 2019,Transavia France,191872738,0,0,1.180875627827798e+18
1180811669905260544,"@imaneik Bonjour, c’est une bonne remarque, nous en prenant note. Pour le moment, nous vous conseillons d’avoir une tablette de chocolat à partager avec l’éventuel bébé à côté de vous pour le garder satisfait. 👼🍫",Sun Oct 06 11:46:55 +0000 2019,Transavia France,191872738,1,0,1.1805990785450025e+18
1180799304807661568,@patricoula Bonjour Patrice ! Je regrette le retard de livraison de vos bagages ce matin. J'espère que vous avez pu les récupérer sans ombrage malgré ce souci. Je reste disponible si vous en avez le besoin et je vous souhaite une douce journée.,Sun Oct 06 10:57:47 +0000 2019,Transavia France,191872738,0,0,1.1807308251486863e+18
1180786082545311744,"@landais_cedric Et bon anniversaire à lui, en lui souhaitant plein de top 1 sur Fortnite ! 😉",Sun Oct 06 10:05:14 +0000 2019,Transavia France,191872738,2,0,
